{
  "version": "v2",
  "metadata": {
    "name": "Bộ Khảo Sát Hướng Nghiệp GenZ",
    "total_questions": 180,
    "scale": {
      "min": 1,
      "max": 5,
      "reverse_formula": "6 - score"
    },
    "notes": "v2 — all 3 tests use Likert 1-5. MBTI uses average, Holland uses sum, OCEAN uses average with reverse scoring."
  },

  "tests": [
    {
      "id": "mbti",
      "name": "Test 1 — MBTI",
      "question_range": { "start": 1, "end": 60 },
      "questions": [
        { "number": 1,  "axis": "E", "reversed": false, "text": "Đi đâu đông vui là em dễ lên mood thật.", "low_label": "Rất không đúng với mình", "high_label": "Rất đúng với mình" },
        { "number": 2,  "axis": "E", "reversed": false, "text": "Gặp người lạ, em thường bắt chuyện khá nhanh.", "low_label": "Rất không đúng với mình", "high_label": "Rất đúng với mình" },
        { "number": 3,  "axis": "E", "reversed": false, "text": "Trong nhóm, em hay là người mở lời trước.", "low_label": "Rất không đúng với mình", "high_label": "Rất đúng với mình" },
        { "number": 4,  "axis": "E", "reversed": false, "text": "Chỗ nào càng rôm rả, em càng dễ nhập cuộc.", "low_label": "Rất không đúng với mình", "high_label": "Rất đúng với mình" },
        { "number": 5,  "axis": "E", "reversed": false, "text": "Em hay nói ra rồi mới thấy rõ mình đang nghĩ gì.", "low_label": "Rất không đúng với mình", "high_label": "Rất đúng với mình" },
        { "number": 6,  "axis": "E", "reversed": false, "text": "Làm việc có người qua lại, tương tác nhiều thường làm em có năng lượng hơn.", "low_label": "Rất không đúng với mình", "high_label": "Rất đúng với mình" },
        { "number": 7,  "axis": "I", "reversed": false, "text": "Đi chơi hay giao tiếp nhiều xong, em cần ở riêng một lúc để hồi pin.", "low_label": "Rất không đúng với mình", "high_label": "Rất đúng với mình" },
        { "number": 8,  "axis": "I", "reversed": false, "text": "Em thường nghĩ trong đầu khá lâu rồi mới nói ra.", "low_label": "Rất không đúng với mình", "high_label": "Rất đúng với mình" },
        { "number": 9,  "axis": "I", "reversed": false, "text": "Em thích nói chuyện ít người nhưng nói cho sâu hơn là nói đông cho vui.", "low_label": "Rất không đúng với mình", "high_label": "Rất đúng với mình" },
        { "number": 10, "axis": "I", "reversed": false, "text": "Nếu bị kéo đi social liên tục, em khá dễ mệt.", "low_label": "Rất không đúng với mình", "high_label": "Rất đúng với mình" },
        { "number": 11, "axis": "I", "reversed": false, "text": "Gặp người mới, em thường cần warm-up chứ không bung liền.", "low_label": "Rất không đúng với mình", "high_label": "Rất đúng với mình" },
        { "number": 12, "axis": "I", "reversed": false, "text": "Em thích có khoảng riêng của mình hơn là lúc nào cũng phải hòa vào đám đông.", "low_label": "Rất không đúng với mình", "high_label": "Rất đúng với mình" },
        { "number": 13, "axis": "S", "reversed": false, "text": "Học cái mới, em thích người ta chỉ rõ từng bước cho dễ theo.", "low_label": "Rất không đúng với mình", "high_label": "Rất đúng với mình" },
        { "number": 14, "axis": "S", "reversed": false, "text": "Em dễ hiểu hơn khi có ví dụ thật, case thật, chuyện thật.", "low_label": "Rất không đúng với mình", "high_label": "Rất đúng với mình" },
        { "number": 15, "axis": "S", "reversed": false, "text": "Em hay để ý mấy chi tiết nhỏ mà người khác dễ lướt qua.", "low_label": "Rất không đúng với mình", "high_label": "Rất đúng với mình" },
        { "number": 16, "axis": "S", "reversed": false, "text": "Em thích câu trả lời rõ ràng, đừng vòng quá nhiều.", "low_label": "Rất không đúng với mình", "high_label": "Rất đúng với mình" },
        { "number": 17, "axis": "S", "reversed": false, "text": "Làm việc gì em cũng thích biết rõ mình cần làm cái gì trước.", "low_label": "Rất không đúng với mình", "high_label": "Rất đúng với mình" },
        { "number": 18, "axis": "S", "reversed": false, "text": "Em thấy yên tâm khi mọi thứ có căn cứ, có bằng chứng, có lý do rõ ràng.", "low_label": "Rất không đúng với mình", "high_label": "Rất đúng với mình" },
        { "number": 19, "axis": "S", "reversed": false, "text": "Em thường nhớ chi tiết cụ thể của một chuyện khá lâu.", "low_label": "Rất không đúng với mình", "high_label": "Rất đúng với mình" },
        { "number": 20, "axis": "S", "reversed": false, "text": "Khi ai đó giải thích, em thích họ nói thẳng, nói thật cụ thể.", "low_label": "Rất không đúng với mình", "high_label": "Rất đúng với mình" },
        { "number": 21, "axis": "S", "reversed": false, "text": "Em hợp kiểu học từ cái gần gũi, sờ được, thấy được, làm được.", "low_label": "Rất không đúng với mình", "high_label": "Rất đúng với mình" },
        { "number": 22, "axis": "S", "reversed": false, "text": "Em thường nhìn chuyện theo kiểu: giờ đang có gì, làm được gì ngay.", "low_label": "Rất không đúng với mình", "high_label": "Rất đúng với mình" },
        { "number": 23, "axis": "S", "reversed": false, "text": "Em thích mọi thứ đừng mơ hồ quá, nói sao cho em biết đường làm.", "low_label": "Rất không đúng với mình", "high_label": "Rất đúng với mình" },
        { "number": 24, "axis": "S", "reversed": false, "text": "Em dễ theo hơn khi người ta nói từ cái cụ thể rồi mới mở rộng ra.", "low_label": "Rất không đúng với mình", "high_label": "Rất đúng với mình" },
        { "number": 25, "axis": "N", "reversed": false, "text": "Học cái mới, em hay muốn biết \"rốt cuộc cái này dùng để làm gì\" trước.", "low_label": "Rất không đúng với mình", "high_label": "Rất đúng với mình" },
        { "number": 26, "axis": "N", "reversed": false, "text": "Nghe một chuyện, em hay tự nghĩ tiếp: \"Rồi sau đó còn có thể thế nào nữa?\"", "low_label": "Rất không đúng với mình", "high_label": "Rất đúng với mình" },
        { "number": 27, "axis": "N", "reversed": false, "text": "Em hay tự liên tưởng từ chuyện này sang chuyện khác, dù người khác chưa nói tới.", "low_label": "Rất không đúng với mình", "high_label": "Rất đúng với mình" },
        { "number": 28, "axis": "N", "reversed": false, "text": "Em thích mấy câu trả lời làm mình kiểu: \"Ủa, còn nghĩ theo hướng này được luôn hả?\"", "low_label": "Rất không đúng với mình", "high_label": "Rất đúng với mình" },
        { "number": 29, "axis": "N", "reversed": false, "text": "Chỉ cần biết đích đến, em khá thích tự xoay cách làm theo kiểu của mình.", "low_label": "Rất không đúng với mình", "high_label": "Rất đúng với mình" },
        { "number": 30, "axis": "N", "reversed": false, "text": "Em dễ bị cuốn bởi những ý tưởng mới, lạ, nghe là muốn nghĩ thêm.", "low_label": "Rất không đúng với mình", "high_label": "Rất đúng với mình" },
        { "number": 31, "axis": "N", "reversed": false, "text": "Em thường nhớ ý chính của một chuyện hơn là nhớ từng chi tiết.", "low_label": "Rất không đúng với mình", "high_label": "Rất đúng với mình" },
        { "number": 32, "axis": "N", "reversed": false, "text": "Khi ai đó giải thích, em thích nghe phần \"logic phía sau\" hơn là chỉ nghe cách làm.", "low_label": "Rất không đúng với mình", "high_label": "Rất đúng với mình" },
        { "number": 33, "axis": "N", "reversed": false, "text": "Em hợp kiểu học mà càng học càng bật ra thêm ý mới trong đầu.", "low_label": "Rất không đúng với mình", "high_label": "Rất đúng với mình" },
        { "number": 34, "axis": "N", "reversed": false, "text": "Em thường nhìn chuyện theo kiểu: từ đây còn mở ra được hướng nào nữa.", "low_label": "Rất không đúng với mình", "high_label": "Rất đúng với mình" },
        { "number": 35, "axis": "N", "reversed": false, "text": "Em thích mấy chủ đề càng đào càng thấy còn nhiều cái hay ho phía sau.", "low_label": "Rất không đúng với mình", "high_label": "Rất đúng với mình" },
        { "number": 36, "axis": "N", "reversed": false, "text": "Em thích nói chuyện kiểu càng nói càng nảy ra thêm ý, chứ không chỉ hỏi xong đáp xong là hết.", "low_label": "Rất không đúng với mình", "high_label": "Rất đúng với mình" },
        { "number": 37, "axis": "T", "reversed": false, "text": "Khi phải chọn nhanh, em thường nghiêng về cái hợp lý hơn.", "low_label": "Rất không đúng với mình", "high_label": "Rất đúng với mình" },
        { "number": 38, "axis": "T", "reversed": false, "text": "Góp ý cho ai đó, em thấy nói rõ vấn đề vẫn quan trọng hơn.", "low_label": "Rất không đúng với mình", "high_label": "Rất đúng với mình" },
        { "number": 39, "axis": "T", "reversed": false, "text": "Khi có chuyện xảy ra, em hay ngồi phân tích xem vấn đề nằm ở đâu trước.", "low_label": "Rất không đúng với mình", "high_label": "Rất đúng với mình" },
        { "number": 40, "axis": "T", "reversed": false, "text": "Cãi nhau mà làm rõ được đúng sai, với em vẫn có ích.", "low_label": "Rất không đúng với mình", "high_label": "Rất đúng với mình" },
        { "number": 41, "axis": "T", "reversed": false, "text": "Em khá tôn trọng kiểu nói thẳng, miễn là nói đúng chuyện.", "low_label": "Rất không đúng với mình", "high_label": "Rất đúng với mình" },
        { "number": 42, "axis": "T", "reversed": false, "text": "Khi xử lý vấn đề, em thường tìm cách giải quyết trước rồi mới nói tới cảm xúc.", "low_label": "Rất không đúng với mình", "high_label": "Rất đúng với mình" },
        { "number": 43, "axis": "F", "reversed": false, "text": "Khi phải chọn nhanh, em thường nghĩ xem quyết định đó sẽ làm ai buồn hay khó xử không.", "low_label": "Rất không đúng với mình", "high_label": "Rất đúng với mình" },
        { "number": 44, "axis": "F", "reversed": false, "text": "Góp ý cho ai đó, em rất để ý cách nói để người ta đỡ bị chạm.", "low_label": "Rất không đúng với mình", "high_label": "Rất đúng với mình" },
        { "number": 45, "axis": "F", "reversed": false, "text": "Khi có chuyện xảy ra, em hay nghĩ tới người trong câu chuyện trước.", "low_label": "Rất không đúng với mình", "high_label": "Rất đúng với mình" },